{
  "schemaVersion": "v0.1",
  "kind": "ConfidentialComputeEscalation",
  "escalationId": "urn:srcos:cc-escalation:office-assist-confidential",
  "invariants": {
    "belowMinimumTierIsRejected": true,
    "unattestedTierRequiringAttestationIsRejected": true,
    "tierOrderingMustBeMonotonic": true,
    "receiptHashAlgorithm": "sha256"
  },
  "computeTiers": [
    {
      "tierRef": "urn:srcos:cc-tier:on-device",
      "tierClass": "on_device",
      "rank": 0,
      "requiresAttestation": false,
      "attestationKind": "none"
    },
    {
      "tierRef": "urn:srcos:cc-tier:sealed-enclave",
      "tierClass": "sealed_enclave",
      "rank": 1,
      "requiresAttestation": true,
      "attestationKind": "enclave_measurement"
    },
    {
      "tierRef": "urn:srcos:cc-tier:attested-tee",
      "tierClass": "attested_tee",
      "rank": 2,
      "requiresAttestation": true,
      "attestationKind": "tee_remote_attestation"
    }
  ],
  "sensitivityClassMap": [
    {
      "sensitivityClass": "public",
      "dataResidencyClass": "on_device_only",
      "minimumTierRef": "urn:srcos:cc-tier:on-device"
    },
    {
      "sensitivityClass": "internal",
      "dataResidencyClass": "on_device_only",
      "minimumTierRef": "urn:srcos:cc-tier:on-device"
    },
    {
      "sensitivityClass": "confidential",
      "dataResidencyClass": "sealed_compute_only",
      "minimumTierRef": "urn:srcos:cc-tier:sealed-enclave"
    },
    {
      "sensitivityClass": "restricted",
      "dataResidencyClass": "attested_compute_only",
      "minimumTierRef": "urn:srcos:cc-tier:attested-tee"
    }
  ],
  "decision": {
    "requestSensitivityClass": "restricted",
    "chosenTierRef": "urn:srcos:cc-tier:attested-tee",
    "reason": "Request carries restricted-class inputs (attested_compute_only residency); task exceeds on-device capability, escalated to the attested TEE tier which satisfies the minimum required tier.",
    "attestationRef": "urn:srcos:attestation:tee:2026-08-03T00:00:00Z:a1b2c3",
    "receiptSha256": "a05ede635e9b4a5fdc86444c5207d9d0cddd626d93e138311d6aa033bd8065ea"
  },
  "notes": "Valid: a restricted-class request run at the attested TEE tier, at or above its required minimum, with an attestation reference for a tier that requires one. Escalation decision, reason, and receipt are first-class provenance."
}
